{
  "activation_requirements": [
    "license_compatibility_review_approved",
    "explicit_user_enablement",
    "toon_or_tru_binary_detected",
    "json_fallback_available"
  ],
  "anti_patterns": [
    "canonical_artifact_storage_as_toon",
    "browser_evidence_storage_as_toon",
    "secret_or_cookie_serialization",
    "raw_chain_of_thought_serialization",
    "unexplained_toon_blocks_in_provider_prompts",
    "required_dependency_for_browser_automation",
    "ungated_or_required_toon_rust_dependency"
  ],
  "bundle_version": "v18.0.0",
  "canonical_storage_format": "json",
  "default_effective_format": "json",
  "fallback_format": "json",
  "hash_requirements": [
    "canonical_json_sha256",
    "toon_payload_sha256_when_used",
    "prompt_manifest_records_serialization_format"
  ],
  "legal_review_required": true,
  "policy_status": "gated_optional",
  "prompt_context_preference": "json",
  "schema_version": "context_serialization_policy.v1",
  "toon_rust": {
    "cli_candidates": [
      "toon",
      "tru"
    ],
    "enabled": false,
    "enabled_by_default": false,
    "key_folding": "safe",
    "library_name": "toon",
    "library_package": "tru",
    "license_note": "Repo license includes an OpenAI/Anthropic rider; do not vendor, install, execute, or require toon_rust from Codex/Claude-driven workflows until user/legal approval is recorded.",
    "license_review_required": true,
    "minimum_version": "0.2.3",
    "prefer_cli": "toon",
    "required": false,
    "source_repo": "https://github.com/Dicklesworthstone/toon_rust",
    "strict_decode": true
  },
  "usage_patterns": [
    "prompt_context_packet_compaction",
    "provider_route_summary_compaction",
    "review_delta_table_compaction",
    "traceability_summary_compaction",
    "prompt_pack_optional_toon_blocks"
  ]
}
